"icd code,Description,DiagnosisNotes"
"635.3,Legally induced abortion, with unspecified complication,""The patient has undergone a legally induced abortion with an unspecified complication. Additional diagnostic tests are required for a precise diagnosis."""
"635.4,Legally induced abortion, failed,""The patient has undergone a legally induced abortion that was not successful, and the pregnancy has not been terminated as intended."""
"636,Illegally induced abortion,""The patient has undergone an illegally induced abortion, which refers to the termination of a pregnancy through medical or surgical means under illegal circumstances."""
"636.0,Illegally induced abortion, complicated by delayed or excessive hemorrhage,""The patient has undergone an illegally induced abortion that is complicated by delayed or excessive hemorrhage (bleeding)."""
"636.1,Illegally induced abortion, with infection,""The patient has undergone an illegally induced abortion that is complicated by infection."""
"636.2,Illegally induced abortion, with other specified complications,""This patient has undergone an illegally induced abortion with other specified complications not covered in other categories. Further evaluation is needed to specify the exact complications."""
"636.3,Illegally induced abortion, with unspecified complication,""The patient has undergone an illegally induced abortion with an unspecified complication. Additional diagnostic tests are required for a precise diagnosis."""
"636.4,Illegally induced abortion, failed,""The patient has undergone an illegally induced abortion that was not successful, and the pregnancy has not been terminated as intended."""
"637,Unspecified abortion,""The patient has experienced an abortion of unspecified type. Additional diagnostic tests are required for a precise diagnosis."""
"638,Failed attempted abortion,""The patient has undergone a failed attempted abortion, indicating an unsuccessful attempt to terminate a pregnancy through medical or surgical means."""
"639,Complications following abortion and ectopic and molar pregnancies,""The patient has developed complications following an abortion, ectopic pregnancy, or molar pregnancy."""
"639.0,Genital tract and pelvic infection following abortion,""The patient has developed a genital tract and pelvic infection following an abortion, which may involve the uterus, fallopian tubes, or other pelvic structures."""
"639.1,Shock following abortion,""The patient has developed shock following an abortion, which is a life-threatening condition characterized by insufficient blood flow to vital organs."""
"639.2,Hemorrhage following abortion,""The patient has developed hemorrhage (bleeding) following an abortion, which may require medical intervention to control."""
"639.3,Retained foreign body following abortion,""The patient has a retained foreign body within the genital tract following an abortion, which may cause discomfort, infection, or other complications."""
"639.4,Injury to pelvic organs following abortion,""The patient has suffered injury to pelvic organs following an abortion, which may involve damage to the uterus, fallopian tubes, or other structures."""
"639.5,Other specified complications following abortion,""This patient has other specified complications following an abortion not covered in other categories. Further evaluation is needed to specify the exact complications."""
"639.6,Unspecified complication following abortion,""The patient has developed an unspecified complication following an abortion. Additional diagnostic tests are required for a precise diagnosis."""
"639.8,Other complications following abortion and ectopic and molar pregnancies,""This patient has other complications following abortion, ectopic pregnancy, or molar pregnancy not classified elsewhere. Further evaluation is needed to specify the exact complications."""
"639.9,Unspecified complication following abortion and ectopic and molar pregnancies,""The patient has developed an unspecified complication following an abortion, ectopic pregnancy, or molar pregnancy. Additional diagnostic tests are required for a precise diagnosis."""
"640,Threatened abortion,""The patient is experiencing a threatened abortion, which indicates the possibility of pregnancy loss without actual abortion."""
"640.0,Threatened abortion, delivered,""The patient has experienced a threatened abortion but has delivered a living baby without an actual abortion occurring."""
"640.8,Other threatened abortion,""This patient has other specified forms of threatened abortion not covered in other categories. Further evaluation is needed to specify the exact type."""
"640.9,Unspecified threatened abortion,""The patient has a threatened abortion of unspecified type. Additional diagnostic tests are required for a precise diagnosis."""
"641,Placenta previa and other current maternal disorders predominantly related to pregnancy,""The patient has placenta previa or other current maternal disorders that are predominantly related to pregnancy."""
"641.0,Placenta previa,""The patient has placenta previa, which occurs when the placenta partially or completely covers the cervix, potentially leading to bleeding during pregnancy."""
"641.1,Threatened premature labor,""The patient has threatened premature labor, indicating that preterm contractions have started but labor has not progressed to the point of delivery."""
"641.2,Other threatened labor,""This patient has other threatened labor not classified elsewhere. Further evaluation is needed to specify the exact nature of the condition."""
"641.3,Old uterine scar,""The patient has an old uterine scar, which may be related to previous uterine surgery, such as a cesarean section."""
"641.8,Other current maternal disorders predominantly related to pregnancy,""This patient has other current maternal disorders predominantly related to pregnancy not covered in other categories. Further evaluation is needed to specify the exact disorder."""
"641.9,Unspecified current maternal disorder predominantly related to pregnancy,""The patient has an unspecified current maternal disorder predominantly related to pregnancy. Additional diagnostic tests are required for a precise diagnosis."""
"642,Hypertension complicating pregnancy, childbirth, and the puerperium,""The patient has hypertension that is complicating pregnancy, childbirth, or the puerperium (postpartum period)."""
"642.0,Pre-existing essential hypertension complicating pregnancy, childbirth, and the puerperium,""The patient has pre-existing essential hypertension (high blood pressure) that existed before pregnancy and is now complicating the pregnancy, childbirth, or the puerperium."""
"642.1,Pre-existing hypertensive heart disease complicating pregnancy, childbirth, and the puerperium,""The patient has pre-existing hypertensive heart disease that existed before pregnancy and is now complicating the pregnancy, childbirth, or the puerperium."""
"642.2,Pre-existing hypertensive renal disease complicating pregnancy, childbirth, and the puerperium,""The patient has pre-existing hypertensive renal (kidney) disease that existed before pregnancy and is now complicating the pregnancy, childbirth, or the puerperium."""
"642.3,Pre-existing hypertensive heart and renal disease complicating pregnancy, childbirth, and the puerperium,""The patient has both pre-existing hypertensive heart disease and hypertensive renal disease that existed before pregnancy and are now complicating the pregnancy, childbirth, or the puerperium."""
"642.4,Pre-existing secondary hypertension complicating pregnancy, childbirth, and the puerperium,""The patient has pre-existing secondary hypertension (high blood pressure caused by an underlying condition) that existed before pregnancy and is now complicating the pregnancy, childbirth, or the puerperium."""
"642.5,Other pre-existing hypertensive diseases complicating pregnancy, childbirth, and the puerperium,""This patient has other pre-existing hypertensive diseases that existed before pregnancy and are now complicating the pregnancy, childbirth, or the puerperium. Further evaluation is needed to specify the exact condition."""
"642.6,Unspecified pre-existing hypertension complicating pregnancy, childbirth, and the puerperium,""The patient has pre-existing hypertension that existed before pregnancy, but the specific type or cause is unspecified. Additional diagnostic tests are required for a precise diagnosis."""
"642.7,Hypertension complicating pregnancy, childbirth, and the puerperium, unspecified as to episode of care,""The patient has hypertension complicating pregnancy, childbirth, and the puerperium, but the episode of care is unspecified (e.g., initial encounter or subsequent encounter)."""
"642.9,Unspecified hypertension complicating pregnancy, childbirth, and the puerperium,""The patient has hypertension complicating pregnancy, childbirth, and the puerperium, but the specific nature or cause is unspecified. Additional diagnostic tests are required for a precise diagnosis."""
"643,Excessive vomiting in pregnancy,""The patient is experiencing excessive vomiting during pregnancy, which may be associated with a condition known as hyperemesis gravidarum."""
"643.0,Excessive vomiting in pregnancy, with metabolic disturbance,""The patient has excessive vomiting in pregnancy, which is causing metabolic disturbances such as dehydration and electrolyte imbalances."""
"643.1,Excessive vomiting in pregnancy, without metabolic disturbance,""The patient has excessive vomiting in pregnancy without associated metabolic disturbances. This condition is known as hyperemesis gravidarum."""
"644,Early or threatened labor,""The patient is experiencing early or threatened labor, indicating that labor contractions have started, but it is too early for the pregnancy to reach full term."""
"644.0,Early or threatened labor, delivered,""The patient has experienced early or threatened labor but has delivered a living baby without the pregnancy reaching full term."""
"644.1,Early or threatened labor, unspecified as to episode of care,""The patient has experienced early or threatened labor, but the episode of care is unspecified (e.g., initial encounter or subsequent encounter)."""
"645,Other poor fetal growth,""The patient's fetus is experiencing poor growth for reasons other than those listed under categories 764-766. These may include various maternal, placental, or fetal factors."""
"645.0,Poor fetal growth, affecting management of the mother,""The patient's fetus has poor growth, which is affecting the management of the mother's pregnancy or health."""
"645.1,Poor fetal growth, not elsewhere classified,""The patient's fetus has poor growth that is not classified elsewhere. Further evaluation is needed to specify the exact cause."""
"645.9,Unspecified poor fetal growth,""The patient's fetus has unspecified poor growth. Additional diagnostic tests are required for a precise diagnosis."""
"646,Other complications of pregnancy, not elsewhere classified,""The patient is experiencing other complications of pregnancy not classified elsewhere."""
"646.0,Other complications predominantly related to pregnancy,""This patient has other complications predominantly related to pregnancy not covered in other categories. Further evaluation is needed to specify the exact complication."""
"646.1,Other complications predominantly related to the puerperium,""The patient has other complications predominantly related to the puerperium (postpartum period) not covered in other categories. Further evaluation is needed to specify the exact complication."""
"646.2,Pregnancy state, incidental,""The patient's pregnancy state is incidental, meaning that it has been identified during a health assessment for other reasons."""
"646.3,Puerperal osteomalacia,""The patient has puerperal osteomalacia, which involves softening of the bones during the postpartum period."""
"646.4,Puerperal thyroid dysfunction,""The patient has puerperal thyroid dysfunction, indicating abnormalities in thyroid function during the postpartum period."""
"646.5,Postpartum acute renal failure,""The patient has developed acute renal failure during the postpartum period, which may be related to various underlying causes."""
"646.6,Other specified puerperal disorders,""This patient has other specified puerperal disorders not covered in other categories. Further evaluation is needed to specify the exact disorder."""
"646.7,Unspecified puerperal disorder,""The patient has an unspecified puerperal disorder. Additional diagnostic tests are required for a precise diagnosis."""
"646.8,Other specified complications of pregnancy, not elsewhere classified,""This patient has other specified complications of pregnancy not covered in other categories. Further evaluation is needed to specify the exact complication."""
"646.9,Unspecified complications of pregnancy, not elsewhere classified,""The patient has unspecified complications of pregnancy not classified elsewhere. Additional diagnostic tests are required for a precise diagnosis."""
"647,Infectious and parasitic conditions in the mother classifiable elsewhere but complicating pregnancy, childbirth, or the puerperium,""The patient has infectious and parasitic conditions that are classifiable elsewhere but are complicating pregnancy, childbirth, or the puerperium."""
"647.0,Infectious and parasitic conditions in the mother, classifiable elsewhere, complicating pregnancy, childbirth, or the puerperium, delivered,""The patient has infectious and parasitic conditions that are classifiable elsewhere, and these conditions are complicating pregnancy, childbirth, or the puerperium. However, the patient has delivered a living baby."""
"647.1,Infectious and parasitic conditions in the mother, classifiable elsewhere, complicating pregnancy, childbirth, or the puerperium, delivered, with mention of postpartum complication,""The patient has infectious and parasitic conditions that are classifiable elsewhere, and these conditions are complicating pregnancy, childbirth, or the puerperium. Additionally, there is a mention of a postpartum complication."""
"647.2,Infectious and parasitic conditions in the mother, classifiable elsewhere, complicating pregnancy, childbirth, or the puerperium, antepartum condition or complication,""The patient has infectious and parasitic conditions that are classifiable elsewhere, and these conditions are complicating pregnancy, childbirth, or the puerperium. The condition or complication is occurring during the antepartum period (before childbirth)."""
"647.3,Infectious and parasitic conditions in the mother, classifiable elsewhere, complicating pregnancy, childbirth, or the puerperium, delivered, with mention of postpartum condition or complication,""The patient has infectious and parasitic conditions that are classifiable elsewhere, and these conditions are complicating pregnancy, childbirth, or the puerperium. The patient has delivered a living baby, and there is a mention of a postpartum condition or complication."""
"647.4,Infectious and parasitic conditions in the mother, classifiable elsewhere, complicating pregnancy, childbirth, or the puerperium, postpartum condition or complication,""The patient has infectious and parasitic conditions that are classifiable elsewhere, and these conditions are complicating pregnancy, childbirth, or the puerperium. There is a postpartum condition or complication without a delivery."""
"647.8,Other infectious and parasitic conditions in the mother classifiable elsewhere, complicating pregnancy, childbirth, or the puerperium,""This patient has other infectious and parasitic conditions in the mother that are classifiable elsewhere and are complicating pregnancy, childbirth, or the puerperium. Further evaluation is needed to specify the exact condition."""
"647.9,Unspecified infectious and parasitic conditions in the mother, complicating pregnancy, childbirth, or the puerperium,""The patient has unspecified infectious and parasitic conditions in the mother that are complicating pregnancy, childbirth, or the puerperium. Additional diagnostic tests are required for a precise diagnosis."""
"648,Other current conditions in the mother classifiable elsewhere but complicating pregnancy, childbirth, or the puerperium,""The patient has other current medical conditions that are classifiable elsewhere but are complicating pregnancy, childbirth, or the puerperium."""
"648.0,Current condition in the mother classifiable elsewhere, complicating pregnancy, childbirth, or the puerperium, delivered,""The patient has a current medical condition that is classifiable elsewhere, and this condition is complicating pregnancy, childbirth, or the puerperium. However, the patient has delivered a living baby."""
"648.1,Current condition in the mother classifiable elsewhere, complicating pregnancy, childbirth, or the puerperium, delivered, with mention of postpartum complication,""The patient has a current medical condition that is classifiable elsewhere, and this condition is complicating pregnancy, childbirth, or the puerperium. Additionally, there is a mention of a postpartum complication."""
"648.2,Current condition in the mother classifiable elsewhere, complicating pregnancy, childbirth, or the puerperium, antepartum condition or complication,""The patient has a current medical condition that is classifiable elsewhere, and this condition is complicating pregnancy, childbirth, or the puerperium. The condition or complication is occurring during the antepartum period (before childbirth)."""
"648.3,Current condition in the mother classifiable elsewhere, complicating pregnancy, childbirth, or the puerperium, delivered, with mention of postpartum condition or complication,""The patient has a current medical condition that is classifiable elsewhere, and this condition is complicating pregnancy, childbirth, or the puerperium. The patient has delivered a living baby, and there is a mention of a postpartum condition or complication."""
"648.4,Current condition in the mother classifiable elsewhere, complicating pregnancy, childbirth, or the puerperium, postpartum condition or complication,""The patient has a current medical condition that is classifiable elsewhere, and this condition is complicating pregnancy, childbirth, or the puerperium. There is a postpartum condition or complication without a delivery."""
"648.5,Other current conditions in the mother classifiable elsewhere, complicating pregnancy, childbirth, or the puerperium,""This patient has other current medical conditions in the mother that are classifiable elsewhere and are complicating pregnancy, childbirth, or the puerperium. Further evaluation is needed to specify the exact condition."""
"648.8,Other specified current conditions in the mother classifiable elsewhere, complicating pregnancy, childbirth, or the puerperium,""This patient has other specified current medical conditions in the mother that are classifiable elsewhere and are complicating pregnancy, childbirth, or the puerperium. Further evaluation is needed to specify the exact condition."""
"648.9,Unspecified current condition in the mother classifiable elsewhere, complicating pregnancy, childbirth, or the puerperium,""The patient has an unspecified current medical condition in the mother that is classifiable elsewhere, and this condition is complicating pregnancy, childbirth, or the puerperium. Additional diagnostic tests are required for a precise diagnosis."""
"649,Hypertension, complicating pregnancy, childbirth, and the puerperium,""The patient has hypertension that is complicating pregnancy, childbirth, and the puerperium (postpartum period)."""
"649.0,Transient hypertension of pregnancy,""The patient has transient hypertension of pregnancy, which is a temporary increase in blood pressure that occurs during pregnancy but resolves after childbirth."""
"649.1,Essential hypertension complicating pregnancy, childbirth, and the puerperium,""The patient has essential hypertension (high blood pressure) that is complicating pregnancy, childbirth, and the puerperium."""
"649.2,Hypertension secondary to renal disease complicating pregnancy, childbirth, and the puerperium,""The patient has hypertension that is secondary to renal (kidney) disease and is complicating pregnancy, childbirth, and the puerperium."""
"649.3,Hypertension secondary to other maternal disorders complicating pregnancy, childbirth, and the puerperium,""The patient has hypertension that is secondary to other maternal disorders and is complicating pregnancy, childbirth, and the puerperium. Further evaluation is needed to specify the exact disorder."""
"649.4,Hypertension secondary to multiple pregnancy,""The patient has hypertension that is secondary to a multiple pregnancy (e.g., twins or triplets) and is complicating pregnancy, childbirth, and the puerperium."""
"649.5,Unspecified hypertension complicating pregnancy, childbirth, and the puerperium,""The patient has unspecified hypertension that is complicating pregnancy, childbirth, and the puerperium. Additional diagnostic tests are required for a precise diagnosis."""
"649.6,Hypertension, complicating pregnancy, childbirth, and the puerperium, unspecified as to episode of care,""The patient has hypertension that is complicating pregnancy, childbirth, and the puerperium, but the episode of care is unspecified (e.g., initial encounter or subsequent encounter)."""
"649.9,Unspecified hypertension complicating pregnancy, childbirth, and the puerperium,""The patient has unspecified hypertension that is complicating pregnancy, childbirth, and the puerperium. Additional diagnostic tests are required for a precise diagnosis."""
"650,Normal delivery,""The patient is undergoing a normal delivery, which refers to a childbirth process without complications."""
"650.0,Vaginal delivery status,""The patient's delivery status is vaginal, indicating that childbirth is occurring through the vaginal canal without the need for surgical intervention."""
"650.1,Failed attempt at vaginal delivery without further specification,""The patient has experienced a failed attempt at vaginal delivery without further specification of the reason for failure. Additional evaluation is required to determine the cause."""
"651,Twin birth,""The patient is giving birth to twins (two babies) during the same pregnancy."""
"651.0,Twin birth, both liveborn,""The patient has given birth to twins, and both babies are liveborn."""
"651.1,Twin birth, one liveborn and one stillborn,""The patient has given birth to twins, and one baby is liveborn while the other is stillborn."""
"651.2,Twin birth, both stillborn,""The patient has given birth to twins, and both babies are stillborn."""
"651.3,Twin birth, not otherwise specified,""The patient has given birth to twins, but the status of the babies is not otherwise specified. Additional evaluation is required for clarification."""
"652,Other multiple gestation,""The patient is experiencing multiple gestation (more than two babies) during the same pregnancy."""
"652.0,Triplet birth,""The patient is giving birth to triplets (three babies) during the same pregnancy."""
"652.1,Quadruplet birth,""The patient is giving birth to quadruplets (four babies) during the same pregnancy."""
"652.2,Quintuplet birth,""The patient is giving birth to quintuplets (five babies) during the same pregnancy."""
"652.3,Sextuplet birth,""The patient is giving birth to sextuplets (six babies) during the same pregnancy."""
"652.4,Other and unspecified multiple gestation,""This patient is experiencing other or unspecified forms of multiple gestation (more than two babies) during the same pregnancy. Further evaluation is needed to specify the exact number of babies and their status."""
"653,Other and unspecified complications of labor and delivery,""The patient is experiencing other or unspecified complications during the labor and delivery process."""
"653.0,Delay in the second stage of labor,""The patient is experiencing a delay in the second stage of labor, which refers to the stage of childbirth from full cervical dilation to the birth of the baby."""
"653.1,Other and unspecified obstructed labor,""The patient is experiencing other or unspecified forms of obstructed labor, which may involve difficulties in the passage of the baby through the birth canal."""
"653.2,Fetopelvic disproportion,""The patient has fetopelvic disproportion, indicating that the baby's size or position is not compatible with safe passage through the mother's pelvis during childbirth."""
"653.3,Disproportion due to generally contracted pelvis,""The patient has disproportion due to a generally contracted pelvis, which refers to a pelvic shape or size that is not suitable for childbirth."""
"653.4,Disproportion due to inlet contraction of pelvis,""The patient has disproportion due to inlet contraction of the pelvis, which refers to a narrowing of the pelvic inlet, making it difficult for the baby to pass through."""
"653.5,Excessive fetal growth affecting management of mother, delivered with or without mention of antepartum condition,""The patient has delivered a baby with excessive fetal growth that affected the management of the mother's pregnancy. This condition may occur with or without an antepartum condition mentioned."""
"653.6,Excessive fetal growth affecting management of mother, antepartum condition or complication,""The patient has excessive fetal growth that is affecting the management of the mother's pregnancy during the antepartum period (before childbirth)."""
"653.7,Previous uterine incision affecting delivery,""The patient has a previous uterine incision (e.g., from a previous cesarean section) that is affecting the current delivery process."""
