"icd code,Description,DiagnosisNotes"
"001,Cholera,The patient presents with symptoms consistent with cholera, including severe watery diarrhea and dehydration. Cholera is suspected based on clinical signs and will be confirmed through laboratory tests.\"
"001.0,Due to Vibrio cholerae,The patient has been diagnosed with cholera caused by Vibrio cholerae. Symptoms include profuse diarrhea, vomiting, and muscle cramps. Immediate treatment and isolation are necessary.\"
"001.1,Due to Vibrio cholerae el tor,The patient is suffering from cholera caused by Vibrio cholerae el tor strain. Symptoms include diarrhea, nausea, and abdominal pain. Prompt rehydration and supportive care are essential.\"
"001.9,Unspecified,The patient's symptoms are consistent with cholera, but the specific strain of Vibrio cholerae is unspecified. The patient exhibits severe diarrhea and signs of dehydration. Further diagnostic tests are needed.\"
"002,Typhoid and paratyphoid fevers,The patient is diagnosed with typhoid or paratyphoid fever, characterized by high fever, abdominal pain, and weakness. These fevers are caused by Salmonella typhi or related strains.\"
"002.0,Typhoid fever,The patient presents with high fever, abdominal discomfort, and a rose-colored rash, indicative of typhoid fever caused by Salmonella typhi. Prompt antibiotic treatment is crucial.\"
"002.1,Paratyphoid fever A,The patient has paratyphoid fever caused by Salmonella paratyphi A. Symptoms include fever, headache, and diarrhea. Laboratory tests will confirm the diagnosis.\"
"002.2,Paratyphoid fever B,The patient's clinical presentation is consistent with paratyphoid fever caused by Salmonella paratyphi B. Symptoms may include fever, gastrointestinal symptoms, and weakness.\"
"002.3,Paratyphoid fever C,The patient exhibits symptoms of paratyphoid fever caused by Salmonella paratyphi C. Clinical signs include fever, abdominal pain, and diarrhea. Laboratory tests are required for confirmation.\"
"002.9,Paratyphoid fever, unspecified,The patient is suspected of having paratyphoid fever, but the specific strain of Salmonella is unspecified. Common symptoms include fever and gastrointestinal distress.\"
"003,Other salmonella infections,The patient is diagnosed with a Salmonella infection other than typhoid or paratyphoid fever. Symptoms may include diarrhea, nausea, and abdominal cramps.\"
"003.0,Salmonella gastroenteritis,The patient has Salmonella gastroenteritis, characterized by diarrhea, vomiting, and abdominal discomfort. The infection is attributed to Salmonella species other than Typhi or Paratyphi.\"
"003.1,Salmonella septicaemia,The patient is diagnosed with Salmonella septicaemia, a severe bloodstream infection. Symptoms include fever, chills, and fatigue. Immediate medical attention is required.\"
"003.2,Localized salmonella infections,The patient has a localized Salmonella infection, which may involve various organs or tissues. Clinical signs depend on the affected area and may include pain and inflammation.\"
"003.8,Other,The patient has a non-specific Salmonella infection. Symptoms vary depending on the strain and affected body system. Further diagnostic tests are needed to confirm the diagnosis.\"
"003.9,Unspecified,The patient's symptoms suggest a Salmonella infection, but the specific type is unspecified. Clinical signs may include diarrhea, nausea, and abdominal pain.\"
"004,Shigellosis,The patient is diagnosed with shigellosis, commonly known as bacillary dysentery. Symptoms include severe diarrhea, abdominal cramps, and fever.\"
"004.0,Shigella dysenteriae,The patient is suffering from shigellosis caused by Shigella dysenteriae. Symptoms include bloody diarrhea, fever, and abdominal pain. Immediate treatment is crucial.\"
"004.1,Shigella flexneri,The patient's clinical presentation is consistent with shigellosis caused by Shigella flexneri. Symptoms include watery diarrhea, fever, and stomach cramps.\"
"004.2,Shigella boydii,The patient has shigellosis attributed to Shigella boydii. Clinical signs may include diarrhea, nausea, and abdominal discomfort.\"
"004.3,Shigella sonnei,The patient is diagnosed with shigellosis caused by Shigella sonnei. Symptoms include diarrhea, fever, and abdominal pain. Hydration and rest are essential for recovery.\"
"004.8,Other,The patient has shigellosis caused by a Shigella strain other than the specified types. Symptoms may vary, but diarrhea and gastrointestinal distress are common.\"
"004.9,Unspecified,The patient's symptoms are indicative of shigellosis, but the specific Shigella strain is unspecified. Clinical signs include diarrhea and abdominal discomfort.\"
"005,Other food poisoning (bacterial),The patient has bacterial food poisoning from sources other than Salmonella or Shigella. Symptoms typically include diarrhea, nausea, and vomiting.\"
"icd code,Description,DiagnosisNotes"
"005.0,Staphylococcal food poisoning,The patient presents with symptoms consistent with staphylococcal food poisoning, including nausea, vomiting, abdominal cramps, and diarrhea. The diagnosis is based on the clinical presentation and a history of consuming contaminated food products."
"005.1,Botulism,The patient exhibits symptoms indicative of botulism, such as muscle weakness, paralysis, blurred vision, and difficulty swallowing or speaking. A history of consuming contaminated food or exposure to botulinum toxin is noted."
"005.2,Food poisoning due to Clostridium perfringens,The patient presents with gastrointestinal symptoms, including abdominal pain and diarrhea, after consuming food that may have been contaminated with Clostridium perfringens. The diagnosis is suspected based on the clinical presentation and food history."
"005.3,Food poisoning due to other Clostridia,The patient shows symptoms of food poisoning, such as nausea, vomiting, and diarrhea, possibly caused by other Clostridium species. The diagnosis is considered based on clinical symptoms and relevant exposure history."
"005.4,Food poisoning due to Vibrio parahaemolyticus,The patient exhibits gastrointestinal symptoms, including watery diarrhea and abdominal cramps, following the consumption of seafood or raw shellfish. The diagnosis suggests food poisoning due to Vibrio parahaemolyticus."
"005.8,Other bacterial food poisoning,The patient presents with symptoms of food poisoning, such as vomiting and diarrhea, and a suspected history of consuming contaminated food. The diagnosis includes various bacterial pathogens that can cause foodborne illnesses."
"005.9,Food poisoning, unspecified,The patient's symptoms resemble food poisoning, but the specific causative agent is unclear. The diagnosis is based on clinical presentation and exposure to potentially contaminated food sources."
"006,Amoebiasis,The patient presents with symptoms such as abdominal pain, diarrhea, and fever, suggesting amoebiasis. The diagnosis is suspected based on clinical symptoms and may involve further testing for Entamoeba histolytica infection."
"006.0,Acute amoebic dysentery without mention of abscess,The patient exhibits symptoms of acute amoebic dysentery, including bloody diarrhea, abdominal cramps, and fever. The diagnosis indicates an acute Entamoeba histolytica infection."
"006.1,Chronic intestinal amoebiasis without mention of abscess,The patient experiences chronic intestinal symptoms like diarrhea and abdominal discomfort, possibly due to chronic Entamoeba histolytica infection. The diagnosis is based on clinical symptoms and history."
"006.2,Amoebic nondysenteric colitis,The patient has symptoms of colitis, including diarrhea and abdominal pain, associated with amoebiasis. The diagnosis suggests amoebic nondysenteric colitis caused by Entamoeba histolytica."
"006.3,Amoebic liver abscess,The patient presents with symptoms of an amoebic liver abscess, such as right upper abdominal pain, fever, and hepatomegaly. The diagnosis indicates a liver abscess due to Entamoeba histolytica."
"006.4,Amoebic lung abscess,The patient exhibits respiratory symptoms, including cough, chest pain, and fever, indicative of an amoebic lung abscess. The diagnosis suggests lung involvement by Entamoeba histolytica."
"006.5,Amoebic brain abscess,The patient experiences neurological symptoms, such as headache, confusion, and focal deficits, suggesting an amoebic brain abscess. The diagnosis implies brain involvement by Entamoeba histolytica."
"006.6,Amoebic skin ulceration,The patient presents with skin ulceration and a history of exposure to Entamoeba histolytica. The diagnosis suggests cutaneous amoebiasis."
"006.8,Amoebic infection of other sites,The patient exhibits symptoms consistent with amoebic infection in various organs or sites, other than those specified. The diagnosis is based on clinical presentation and relevant exposure history."
"006.9,Amoebiasis, unspecified,The patient displays symptoms indicative of amoebiasis, but the specific site or type of infection is unspecified. The diagnosis suggests an unspecified amoebic infection."
"007,Other protozoal intestinal diseases,The patient exhibits gastrointestinal symptoms that may be associated with protozoal infections other than amoebiasis. The diagnosis considers various protozoal pathogens and clinical presentation."
"007.0,Balantidiasis,The patient presents with symptoms consistent with balantidiasis, such as diarrhea, abdominal pain, and sometimes dysentery. The diagnosis suggests an infection with Balantidium coli."
"007.1,Giardiasis,The patient exhibits symptoms of giardiasis, including diarrhea, abdominal cramps, and bloating. The diagnosis suggests an infection with Giardia lamblia."
"007.2,Coccidiosis,The patient displays symptoms of coccidiosis, such as diarrhea and abdominal discomfort, possibly due to infection with Isospora belli or Isospora hominis. The diagnosis considers coccidial infections."
"007.3,Intestinal trichomoniasis,The patient presents with symptoms suggestive of intestinal trichomoniasis, such as diarrhea and abdominal pain, possibly caused by Trichomonas intestinalis. The diagnosis implies an intestinal trichomonad infection."
"007.8,Other protozoal intestinal diseases,The patient exhibits gastrointestinal symptoms that may be associated with other protozoal infections not specified above. The diagnosis considers various protozoal pathogens and clinical presentation."
"007.9,Unspecified,The patient experiences gastrointestinal symptoms resembling protozoal intestinal diseases, but the specific causative agent is unclear. The diagnosis is based on clinical presentation and exposure history."
"008,Intestinal infections due to other organisms,The patient presents with gastrointestinal symptoms indicative of infections caused by organisms other than protozoa. The diagnosis includes various bacterial and viral pathogens associated with enteric infections."
"008.0,Escherichia coli [E. coli],The patient exhibits symptoms consistent with Escherichia coli infection, such as diarrhea, abdominal pain, and sometimes bloody stools. The diagnosis suggests an enteric infection with E. coli."
"008.1,Arizona,The patient presents with symptoms possibly related to Arizona infection, including gastrointestinal symptoms and fever. The diagnosis considers Arizona bacteria as a potential causative agent."
"008.2,Aerobacter aerogenes,The patient displays symptoms that may be attributed to Aerobacter aerogenes infection, such as gastrointestinal symptoms. The diagnosis suggests an enteric infection with Aerobacter aerogenes."
"008.3,Proteus (mirabilis) (morganii),The patient exhibits symptoms suggestive of Proteus infection, including diarrhea and abdominal discomfort. The diagnosis implies an enteric infection with Proteus species (mirabilis or morganii)."
"008.4,Other specified bacteria,The patient presents with gastrointestinal symptoms possibly linked to other specified bacterial pathogens. The diagnosis considers various bacterial species and their associated enteric infections."
"008.5,Bacterial enteritis, unspecified,The patient displays symptoms of bacterial enteritis, but the specific bacterial agent is unclear. The diagnosis implies unspecified bacterial enteritis based on clinical presentation."
"008.6,Enteritis due to specified virus,The patient exhibits symptoms of enteritis likely caused by a specified virus, such as adenovirus or enterovirus. The diagnosis considers viral enteritis."
"008.8,Other organism, not elsewhere classified,The patient presents with gastrointestinal symptoms possibly related to infections caused by organisms not classified elsewhere. The diagnosis considers various pathogens and clinical presentation."
"009,Ill-defined intestinal infections,The patient displays gastrointestinal symptoms indicative of ill-defined intestinal infections, which may be associated with various causative agents. The diagnosis considers nonspecific enteric infections."
"009.0,Infectious colitis, enteritis, and gastroenteritis,The patient exhibits symptoms of infectious colitis, enteritis, or gastroenteritis, including diarrhea and abdominal pain. The diagnosis suggests an infectious etiology for the gastrointestinal symptoms."
"009.2,Infectious diarrhea,The patient presents with diarrhea that is likely due to an infectious cause. The diagnosis considers various infectious agents that can lead to diarrhea."
"010,Primary tuberculous infection,The patient is suspected of having a primary tuberculous infection, which typically involves the initial exposure to Mycobacterium tuberculosis. The diagnosis is based on clinical and radiological findings."
"010.0,Primary tuberculous complex,The patient exhibits signs and symptoms suggestive of a primary tuberculous complex, which may involve lymph node enlargement and lung involvement. The diagnosis considers the presence of a primary tuberculous complex."
"010.1,Tuberculous pleurisy in primary progressive tuberculosis,The patient presents with symptoms of pleurisy and lung involvement consistent with primary progressive tuberculosis. The diagnosis suggests tuberculous pleurisy in the context of primary tuberculosis."
"010.8,Other primary progressive tuberculosis,The patient exhibits clinical features of primary progressive tuberculosis, with organ involvement other than the lung or pleura. The diagnosis considers primary tuberculosis affecting other sites."
"010.9,Unspecified,The patient shows signs of tuberculosis, but the specific classification within primary tuberculosis is unspecified. Further evaluation is needed to determine the exact site and extent of the infection."
"011,Pulmonary tuberculosis,The patient is suspected of having pulmonary tuberculosis, with symptoms and findings indicative of lung involvement by Mycobacterium tuberculosis. The diagnosis includes various forms of pulmonary tuberculosis."
"011.0,Tuberculosis of lung, infiltrative,The patient exhibits an infiltrative pattern on chest imaging and symptoms consistent with tuberculosis, suggesting infiltrative lung tuberculosis."
"011.1,Tuberculosis of lung, nodular,The patient presents with nodular lesions on chest imaging and clinical symptoms indicative of tuberculosis, suggesting nodular lung tuberculosis."
"011.2,Tuberculosis of lung with cavitation,The patient displays cavities on chest imaging, which are characteristic of tuberculosis, along with symptoms of lung tuberculosis with cavitation."
"011.3,Tuberculosis of bronchus,The patient exhibits bronchial involvement by tuberculosis, with symptoms suggesting bronchial tuberculosis."
"011.4,Tuberculous fibrosis of lung,The patient presents with lung fibrosis and clinical features consistent with tuberculosis, indicating fibrotic lung tuberculosis."
"011.5,Tuberculous bronchiectasis,The patient displays bronchiectasis and symptoms of bronchiectatic lung tuberculosis, which involves dilated bronchi."
"011.6,Tuberculous pneumonia [any form],The patient exhibits pneumonia-like symptoms and findings indicative of tuberculosis, suggesting various forms of tuberculous pneumonia."
"011.7,Tuberculous pneumothorax,The patient experiences a pneumothorax associated with tuberculosis, with symptoms and radiological evidence supporting the diagnosis of tuberculous pneumothorax."
"011.8,Other pulmonary tuberculosis,The patient presents with pulmonary tuberculosis features not classified elsewhere, indicating other forms of pulmonary tuberculosis."
"011.9,Unspecified,The patient exhibits symptoms and findings suggestive of pulmonary tuberculosis, but the specific classification within pulmonary tuberculosis is unspecified. Further evaluation is needed to determine the exact form of pulmonary tuberculosis."
"012,Other respiratory tuberculosis,The patient is suspected of having respiratory tuberculosis other than pulmonary tuberculosis, with symptoms and findings indicative of respiratory involvement by Mycobacterium tuberculosis. The diagnosis includes various forms of respiratory tuberculosis."
"012.0,Tuberculous pleurisy,The patient presents with pleurisy and respiratory symptoms consistent with tuberculous pleurisy. The diagnosis suggests pleural involvement by Mycobacterium tuberculosis."
"012.1,Tuberculosis of intrathoracic lymph nodes,The patient exhibits lymph node enlargement within the thoracic region and respiratory symptoms suggestive of tuberculosis. The diagnosis implies tuberculosis involving intrathoracic lymph nodes."
"012.2,Isolated tracheal or bronchial tuberculosis,The patient shows symptoms and respiratory findings indicative of tuberculosis affecting the trachea or bronchi in isolation. The diagnosis suggests isolated tracheal or bronchial tuberculosis."
"012.3,Tuberculous laryngitis,The patient experiences symptoms of laryngitis, including hoarseness and throat discomfort, suggestive of tuberculous laryngitis. The diagnosis implies laryngeal involvement by Mycobacterium tuberculosis."
"012.8,Other,The patient presents with respiratory tuberculosis features not classified elsewhere, indicating other forms of respiratory tuberculosis, including mediastinal, nasopharyngeal, nasal, or sinus involvement."
"013,Tuberculosis of meninges and central nervous system,The patient is suspected of having tuberculosis involving the meninges and central nervous system, with symptoms and findings indicative of neurological tuberculosis. The diagnosis encompasses various forms of central nervous system tuberculosis."
"013.0,Tuberculous meningitis,The patient exhibits symptoms of meningitis, such as headache, neck stiffness, and neurological deficits, suggestive of tuberculous meningitis. The diagnosis indicates meningeal involvement by Mycobacterium tuberculosis."
"013.1,Tuberculoma of meninges,The patient presents with clinical and radiological evidence of tuberculoma within the meninges. The diagnosis implies the presence of tuberculous granuloma in the meninges."
"013.8,Other,The patient displays features of central nervous system tuberculosis not classified elsewhere, indicating other forms of tuberculosis involving the central nervous system, such as tuberculous brain abscess or myelitis."
"013.9,Unspecified,The patient shows symptoms and findings suggestive of central nervous system tuberculosis, but the specific classification within this category is unspecified. Further evaluation is needed to determine the exact form of central nervous system tuberculosis."
"014,Tuberculosis of intestines, peritoneum, and mesenteric glands,The patient is suspected of having tuberculosis affecting the intestines, peritoneum, or mesenteric glands, with symptoms and findings indicative of abdominal tuberculosis. The diagnosis includes various forms of abdominal tuberculosis."
"015,Tuberculosis of bones and joints,The patient presents with symptoms suggestive of tuberculosis involving the bones and joints, with clinical features such as joint pain, swelling, and bone abnormalities. The diagnosis encompasses various forms of skeletal tuberculosis."
"015.0,Vertebral column,The patient exhibits symptoms and radiological evidence of tuberculosis affecting the vertebral column, suggesting vertebral column tuberculosis or Pott's disease."
"015.1,Hip,The patient experiences symptoms and clinical findings indicative of tuberculosis affecting the hip joint, implying hip joint tuberculosis."
"015.2,Knee,The patient presents with symptoms and clinical features consistent with tuberculosis involving the knee joint, suggesting knee joint tuberculosis."
"015.7,Other bone,The patient displays symptoms and clinical features of bone tuberculosis not classified elsewhere, indicating other forms of bone tuberculosis, such as tuberculous dactylitis or mastoiditis."
"015.8,Other joint,The patient exhibits symptoms and clinical features of joint tuberculosis not classified elsewhere, indicating other forms of joint tuberculosis."
"015.9,Unspecified,The patient shows symptoms and findings suggestive of skeletal tuberculosis, but the specific classification within bone and joint tuberculosis is unspecified. Further evaluation is needed to determine the exact site of involvement."
"016,Tuberculosis of genitourinary system,The patient is suspected of having tuberculosis affecting the genitourinary system, with symptoms and findings indicative of genitourinary tuberculosis. The diagnosis includes various forms of genitourinary tuberculosis."
"016.0,Kidney,The patient presents with symptoms and clinical features consistent with tuberculosis involving the kidney, suggesting renal tuberculosis."
"016.1,Other urinary organs,The patient exhibits symptoms and clinical findings indicative of tuberculosis affecting other urinary organs, including the bladder or ureter."
"016.2,Epididymis,The patient experiences symptoms and clinical features suggestive of tuberculosis involving the epididymis, implying epididymal tuberculosis."
"016.3,Other male genital organs,The patient shows symptoms and clinical features of tuberculosis affecting other male genital organs, such as the prostate, seminal vesicle, or testis."
"016.4,Female genital organs,The patient exhibits symptoms and clinical features suggestive of tuberculosis involving female genital organs, including the ovaries or fallopian tubes. The diagnosis includes tuberculous oophoritis or salpingitis."
"016.9,Unspecified,The patient displays symptoms and findings suggestive of genitourinary tuberculosis, but the specific classification within this category is unspecified. Further evaluation is needed to determine the exact site of genitourinary involvement."
"017,Tuberculosis of other organs,The patient is suspected of having tuberculosis affecting organs other than those specified elsewhere, with symptoms and findings indicative of extrapulmonary tuberculosis. The diagnosis includes various forms of extrapulmonary tuberculosis."
"017.0,Skin and subcutaneous cellular tissue,The patient exhibits skin lesions and clinical features consistent with cutaneous tuberculosis, including lupus vulgaris, scrofuloderma, or papulonecrotica. The diagnosis implies skin and subcutaneous cellular tissue involvement by Mycobacterium tuberculosis."
"017.1,Erythema nodosum with hypersensitivity reaction in tuberculosis,The patient presents with erythema nodosum associated with a hypersensitivity reaction in the context of tuberculosis. The diagnosis suggests erythema nodosum with a tuberculosis-related immune response."
"017.2,Peripheral lymph nodes,The patient displays lymph node enlargement, abscesses, or other clinical features indicative of tuberculosis involving peripheral lymph nodes, such as scrofula or scrofulous abscess. The diagnosis considers peripheral lymph node tuberculosis."
"017.3,Eye,The patient exhibits eye-related symptoms, including chorioretinitis, episcleritis, keratitis, iridocyclitis, or keratoconjunctivitis, suggestive of tuberculosis involvement in the eye. The diagnosis includes various forms of ocular tuberculosis."
"017.4,Ear,The patient presents with ear-related symptoms, possibly indicating tuberculosis of the ear or otitis media due to Mycobacterium tuberculosis. The diagnosis considers ear involvement by tuberculosis."
"017.5,Thyroid gland,The patient displays symptoms and clinical features suggestive of thyroid gland involvement by tuberculosis. The diagnosis implies tuberculosis affecting the thyroid gland."
"017.6,Adrenal glands,The patient exhibits clinical features indicative of adrenal gland involvement by tuberculosis, possibly leading to Addison's disease. The diagnosis considers adrenal gland tuberculosis."
"017.7,Spleen,The patient shows symptoms and findings suggestive of tuberculosis involving the spleen. The diagnosis includes splenic tuberculosis."
"017.8,Other,The patient presents with clinical features of tuberculosis affecting organs not classified elsewhere, indicating other forms of extrapulmonary tuberculosis, such as tuberculosis of the endocardium, esophagus, myocardium, or pericardium."
"018,Miliary tuberculosis,The patient is suspected of having miliary tuberculosis, characterized by disseminated infection involving multiple organs. The diagnosis includes various forms of miliary tuberculosis."
"018.0,Acute,The patient exhibits acute miliary tuberculosis, with symptoms and findings indicative of rapidly progressing disseminated infection. The diagnosis suggests acute miliary tuberculosis."
"018.8,Other,The patient presents with clinical features of miliary tuberculosis not classified elsewhere, indicating other forms of miliary tuberculosis, such as generalized or polyserositis."
"018.9,Unspecified,The patient displays symptoms and findings suggestive of miliary tuberculosis, but the specific classification within this category is unspecified. Further evaluation is needed to determine the exact form of miliary tuberculosis."
